{
  "schema_version": 1,
  "run_id": "batch_10_physics_3b1b_feynman",
  "output_dir": "output/manual_batch_10",
  "tasks": [
    {
      "id": "lesson_01",
      "action": "video.lesson_plan",
      "params": {
        "topic": "Kinematics: Reading Velocity-Time Graphs",
        "style": "Feynman elegance with 3b1b visual morphing",
        "formats": ["horizontal", "vertical"],
        "type": "concept"
      }
    },
    {
      "id": "lesson_02",
      "action": "video.lesson_plan",
      "params": {
        "topic": "Vectors: Dot Product and Projections",
        "style": "Geometric intuition (3b1b) with minimal jargon",
        "formats": ["horizontal", "vertical"],
        "type": "problem"
      }
    },
    {
      "id": "lesson_03",
      "action": "video.lesson_plan",
      "params": {
        "topic": "Newton's Laws: Constraints and Pulleys",
        "style": "Step-by-step physical intuition",
        "formats": ["horizontal", "vertical"],
        "type": "concept"
      }
    },
    {
      "id": "lesson_04",
      "action": "video.lesson_plan",
      "params": {
        "topic": "Work-Energy Theorem in Variable Forces",
        "style": "Visual area under the curve exploration",
        "formats": ["horizontal", "vertical"],
        "type": "problem"
      }
    },
    {
      "id": "lesson_05",
      "action": "video.lesson_plan",
      "params": {
        "topic": "Center of Mass: Shifting Reference Frames",
        "style": "Elegant simplicity, focusing on symmetry",
        "formats": ["horizontal", "vertical"],
        "type": "concept"
      }
    },
    {
      "id": "lesson_06",
      "action": "video.lesson_plan",
      "params": {
        "topic": "Rotational Dynamics: Moment of Inertia",
        "style": "Visualizing mass distribution like a fluid",
        "formats": ["horizontal", "vertical"],
        "type": "problem"
      }
    },
    {
      "id": "lesson_07",
      "action": "video.lesson_plan",
      "params": {
        "topic": "Simple Harmonic Motion: The Geometry of Sine Waves",
        "style": "Connecting circular motion to linear SHM",
        "formats": ["horizontal", "vertical"],
        "type": "concept"
      }
    },
    {
      "id": "lesson_08",
      "action": "video.lesson_plan",
      "params": {
        "topic": "Gravitation: Kepler's Laws and Elliptical Orbits",
        "style": "Beautiful orbital mechanics visuals",
        "formats": ["horizontal", "vertical"],
        "type": "problem"
      }
    },
    {
      "id": "lesson_09",
      "action": "video.lesson_plan",
      "params": {
        "topic": "Thermodynamics: First Law and P-V Diagrams",
        "style": "Energy conservation as a flowing river",
        "formats": ["horizontal", "vertical"],
        "type": "concept"
      }
    },
    {
      "id": "lesson_10",
      "action": "video.lesson_plan",
      "params": {
        "topic": "Electrostatics: Gauss's Law and Flux",
        "style": "Visualizing electric fields as a continuous flow",
        "formats": ["horizontal", "vertical"],
        "type": "problem"
      }
    }
  ]
}
